[
  {
    "id": "mobile-money-operator-abeg-technologies-limited",
    "name": "Abeg Technologies Limited",
    "institution_type": "mobile_money_operator",
    "country_code": "NG"
  },
  {
    "id": "mobile-money-operator-chams-mobile",
    "name": "Chams Mobile",
    "institution_type": "mobile_money_operator",
    "country_code": "NG",
    "cbn_code": "929",
    "logo_url": "/v1/assets/financial-institutions/ng/payment-service-providers/mobile-money-operator-chams-mobile.png",
    "website_url": "https://chamsmobile.com/"
  },
  {
    "id": "mobile-money-operator-etranzact-international-limited",
    "name": "eTranzact International Limited",
    "institution_type": "mobile_money_operator",
    "country_code": "NG",
    "cbn_code": "920",
    "nip_code": "100006",
    "logo_url": "/v1/assets/financial-institutions/ng/payment-service-providers/mobile-money-operator-etranzact-international-limited.png",
    "website_url": "https://www.etranzact.ng/"
  },
  {
    "id": "mobile-money-operator-fortis-mobile-money-limited",
    "name": "Fortis Mobile Money Limited",
    "institution_type": "mobile_money_operator",
    "country_code": "NG",
    "cbn_code": "930",
    "nip_code": "100016",
    "logo_url": "/v1/assets/financial-institutions/ng/payment-service-providers/mobile-money-operator-fortis-mobile-money-limited.png",
    "website_url": "https://fortismobilemoney.com/"
  },
  {
    "id": "mobile-money-operator-funds-and-electronic-transfer-fets-limited",
    "name": "Funds And Electronic Transfer (FETS) Limited",
    "institution_type": "mobile_money_operator",
    "country_code": "NG",
    "website_url": "https://www.fetslimited.com/"
  },
  {
    "id": "mobile-money-operator-hedonmark-management-services-limited",
    "name": "Hedonmark Management Services Limited",
    "institution_type": "mobile_money_operator",
    "country_code": "NG",
    "cbn_code": "931",
    "logo_url": "/v1/assets/financial-institutions/ng/payment-service-providers/mobile-money-operator-hedonmark-management-services-limited.png"
  },
  {
    "id": "mobile-money-operator-kongapay-technologies-limited",
    "name": "KongaPay Technologies Limited",
    "institution_type": "mobile_money_operator",
    "country_code": "NG",
    "cbn_code": "939",
    "nip_code": "100025",
    "logo_url": "/v1/assets/financial-institutions/ng/payment-service-providers/mobile-money-operator-kongapay-technologies-limited.png",
    "website_url": "https://www.kongapay.com/"
  },
  {
    "id": "mobile-money-operator-mkudi-limited",
    "name": "Mkudi Limited",
    "institution_type": "mobile_money_operator",
    "country_code": "NG",
    "nip_code": "100011",
    "logo_url": "/v1/assets/financial-institutions/ng/payment-service-providers/mobile-money-operator-mkudi-limited.png"
  },
  {
    "id": "mobile-money-operator-nownow-digital-systems-limited",
    "name": "NowNow Digital Systems Limited",
    "institution_type": "mobile_money_operator",
    "country_code": "NG",
    "website_url": "https://nownow.ng/",
    "logo_url": "/v1/assets/financial-institutions/ng/payment-service-providers/mobile-money-operator-nownow-digital-systems-limited.png"
  },
  {
    "id": "mobile-money-operator-opay-digital-services-limited",
    "name": "Opay Digital Services Limited",
    "institution_type": "mobile_money_operator",
    "country_code": "NG",
    "nip_code": "100004",
    "logo_url": "/v1/assets/financial-institutions/ng/payment-service-providers/mobile-money-operator-opay-digital-services-limited.png",
    "website_url": "https://www.opaybank.com/"
  },
  {
    "id": "mobile-money-operator-pagatech-limited",
    "name": "Pagatech Limited",
    "institution_type": "mobile_money_operator",
    "country_code": "NG",
    "cbn_code": "916",
    "nip_code": "100002",
    "logo_url": "/v1/assets/financial-institutions/ng/payment-service-providers/mobile-money-operator-pagatech-limited.png",
    "website_url": "https://www.mypaga.com/"
  },
  {
    "id": "mobile-money-operator-palmpay-limited",
    "name": "PalmPay Limited",
    "institution_type": "mobile_money_operator",
    "country_code": "NG",
    "nip_code": "100033",
    "logo_url": "/v1/assets/financial-institutions/ng/payment-service-providers/mobile-money-operator-palmpay-limited.png"
  },
  {
    "id": "mobile-money-operator-parkway-projects-limited",
    "name": "Parkway Projects Limited.",
    "institution_type": "mobile_money_operator",
    "country_code": "NG",
    "website_url": "https://parkway.ng/",
    "logo_url": "/v1/assets/financial-institutions/ng/payment-service-providers/mobile-money-operator-parkway-projects-limited.png"
  },
  {
    "id": "mobile-money-operator-teasy-international-company-ltd",
    "name": "Teasy International Company Ltd",
    "institution_type": "mobile_money_operator",
    "country_code": "NG",
    "cbn_code": "924",
    "logo_url": "/v1/assets/financial-institutions/ng/payment-service-providers/mobile-money-operator-teasy-international-company-ltd.png"
  },
  {
    "id": "mobile-money-operator-visual-ict-limited",
    "name": "Visual ICT Limited",
    "institution_type": "mobile_money_operator",
    "country_code": "NG",
    "website_url": "https://visualict.com/"
  },
  {
    "id": "mobile-money-operator-vtnetwork-limited",
    "name": "VTNetwork Limited",
    "institution_type": "mobile_money_operator",
    "country_code": "NG",
    "cbn_code": "926",
    "nip_code": "100012"
  },
  {
    "id": "mobile-money-operator-xpress-mts-limited",
    "name": "Xpress MTS Limited",
    "institution_type": "mobile_money_operator",
    "country_code": "NG",
    "nip_code": "100041",
    "logo_url": "/v1/assets/financial-institutions/ng/payment-service-providers/mobile-money-operator-xpress-mts-limited.png",
    "website_url": "https://xpressmts.com/"
  },
  {
    "id": "switching-and-processing-company-arca-payments-company-limited",
    "name": "Arca Payments Company Limited",
    "institution_type": "switching_and_processing_company",
    "country_code": "NG",
    "website_url": "https://arca.network/"
  },
  {
    "id": "switching-and-processing-company-belema-financial-technology-limited",
    "name": "Belema Financial Technology Limited",
    "institution_type": "switching_and_processing_company",
    "country_code": "NG"
  },
  {
    "id": "switching-and-processing-company-chamswitch-limited",
    "name": "Chamswitch Limited",
    "institution_type": "switching_and_processing_company",
    "country_code": "NG"
  },
  {
    "id": "switching-and-processing-company-coralpay-technology-nigeria-limited",
    "name": "Coralpay Technology Nigeria Limited",
    "institution_type": "switching_and_processing_company",
    "country_code": "NG",
    "website_url": "https://www.coralpay.com/"
  },
  {
    "id": "switching-and-processing-company-etranzact-international-limited",
    "name": "eTranzact International Limited",
    "institution_type": "switching_and_processing_company",
    "country_code": "NG",
    "cbn_code": "920",
    "nip_code": "100006",
    "logo_url": "/v1/assets/financial-institutions/ng/payment-service-providers/switching-and-processing-company-etranzact-international-limited.png",
    "website_url": "https://www.etranzact.ng/"
  },
  {
    "id": "switching-and-processing-company-flutterwave-technology-solutions-limited",
    "name": "Flutterwave Technology Solutions Limited",
    "institution_type": "switching_and_processing_company",
    "country_code": "NG",
    "nip_code": "110002",
    "logo_url": "/v1/assets/financial-institutions/ng/payment-service-providers/switching-and-processing-company-flutterwave-technology-solutions-limited.png",
    "website_url": "https://flutterwave.com/"
  },
  {
    "id": "switching-and-processing-company-habaripay-limited",
    "name": "Habaripay Limited",
    "institution_type": "switching_and_processing_company",
    "country_code": "NG"
  },
  {
    "id": "switching-and-processing-company-hydrogen-payment-services-limited",
    "name": "Hydrogen Payment Services Limited",
    "institution_type": "switching_and_processing_company",
    "country_code": "NG",
    "website_url": "https://www.hydrogenpay.com/"
  },
  {
    "id": "switching-and-processing-company-interswitch-limited",
    "name": "Interswitch Limited",
    "institution_type": "switching_and_processing_company",
    "country_code": "NG",
    "website_url": "https://www.interswitchgroup.com/"
  },
  {
    "id": "switching-and-processing-company-network-international",
    "name": "Network International",
    "institution_type": "switching_and_processing_company",
    "country_code": "NG",
    "website_url": "https://nigeria.network.global/"
  },
  {
    "id": "switching-and-processing-company-paystack-payment-limited",
    "name": "Paystack Payment Limited",
    "institution_type": "switching_and_processing_company",
    "country_code": "NG"
  },
  {
    "id": "switching-and-processing-company-remita-payment-service-limited",
    "name": "Remita Payment Service Limited",
    "institution_type": "switching_and_processing_company",
    "country_code": "NG"
  },
  {
    "id": "switching-and-processing-company-say-switch-limited",
    "name": "Say Switch Limited",
    "institution_type": "switching_and_processing_company",
    "country_code": "NG",
    "website_url": "https://www.sayswitchgroup.com/"
  },
  {
    "id": "switching-and-processing-company-teamapt-limited",
    "name": "Teamapt Limited",
    "institution_type": "switching_and_processing_company",
    "country_code": "NG"
  },
  {
    "id": "switching-and-processing-company-terra-switching-processing-company-limited",
    "name": "Terra Switching & Processing Company Limited",
    "institution_type": "switching_and_processing_company",
    "country_code": "NG"
  },
  {
    "id": "switching-and-processing-company-unified-payment-services-limited",
    "name": "Unified Payment Services Limited",
    "institution_type": "switching_and_processing_company",
    "country_code": "NG"
  },
  {